name,lat,lon,open,close,province
ร้านก๋วยเตี๋ยวเก๊ามะขาม,19.0929418,98.9276329,7:30,15:30,Chiang Mai
ร้านอาหารไกลเวียง 2,19.1268296,98.94904,11:00,0:00,Chiang Mai
ไอดินกลิ่นนา / I-DIN KLIN NA Thai Food Restaurant,19.1439801,98.991641,16:00,22:00,Chiang Mai
ร้านตำแซ่บbyแพท,19.1341167,99.0621641,12:00,21:00,Chiang Mai
ร้านไส้อั่วแม่พัตร,19.079476,98.9376846,8:00,5:00,Chiang Mai
ฮ่มไทรคาเฟ่ หน้าอำเภอแม่แตง (Homsai Cafe and Restaurant),19.1214795,98.9442951,7:00,23:30,Chiang Mai
ร้านริมคลองแอนด์มานาคาเฟ่,19.1542696,98.9806384,7:30,16:00,Chiang Mai
เสวนา,19.1286071,98.9492306,17:30,0:00,Chiang Mai
ร้านจั๋น รอนาน อาหารตามสั่ง,19.1464003,98.8616325,7:30,20:00,Chiang Mai
เจ้อ้วนริมน้ำ,19.1695552,98.8578167,8:00,20:00,Chiang Mai
ฮิมแกน,19.1441828,98.9939233,9:00,19:00,Chiang Mai
ร้านช้างยิ้ม แก่งกื้ด,19.2205851,98.8440303,9:30,17:30,Chiang Mai
FAR AWAY,19.0811099,98.9077612,9:30,17:00,Chiang Mai
ข้าวซอยเจ้ซิง,19.2437205,98.6553278,7:00,18:00,Chiang Mai
ส้มตำกาฬสินธุ์แม่แตง,19.0902561,98.9365823,12:00,20:30,Chiang Mai
ร้าน ก๋วยเตี๋ยว รสเด็ด,19.1099463,98.9377695,7:30,4:00,Chiang Mai
ร้านลุงเษม แก่งกื้ด,19.2203168,98.8411924,10:00,19:00,Chiang Mai
เเดนเทวดา,19.1232017,98.9420572,8:00,18:00,Chiang Mai
ร้านอาหารคำหลวง,19.0872362,98.8998026,7:00,20:00,Chiang Mai
Nugket restaurant ครัวนักเก็ต,19.1101225,98.9383617,6:00,23:30,Chiang Mai
ลุงเชียรก๋วยเตียวเป็ดตุ๋น แม่แตง,19.1220618,98.9426937,9:00,17:00,Chiang Mai
ครัวอาต๋อง อร่อยต้องลอง,19.0935938,98.9330931,7:00,16:00,Chiang Mai
Wan Chune - วันชื่น @ม่อนปาร์ค,19.0944627,98.9015263,8:00,17:00,Chiang Mai
ร้านใบบัว,19.2205491,98.8445175,9:00,17:00,Chiang Mai
ร้านข้าวซอยแม่นาย สาขา2,19.0668483,98.9392976,8:00,16:00,Chiang Mai
สวนสนคาเฟ่ Suansoncafe,19.1493948,98.947104,8:00,17:30,Chiang Mai
ร้านไหมข้าวมันไก่,19.1136576,98.9394547,8:00,19:00,Chiang Mai
ครัวคุณต้อย,19.0789375,98.9413125,9:00,17:00,Chiang Mai
Road View Restaurant,19.166285,98.6909718,7:00,17:00,Chiang Mai
ร้านอาหารลำริมทุ่ง ก๋วยเตี๋ยว,19.1370399,98.9236065,8:00,18:00,Chiang Mai
ร้านลาบแม่หลวง,19.0638714,98.9378883,9:30,22:00,Chiang Mai
ร้านอาหารโฮมเมดสตาร์,19.2603413,98.9712156,9:00,20:00,Chiang Mai
ส้มตำฉำฉา,19.1521218,99.0157037,10:00,17:00,Chiang Mai
ร้านลาบน้ำต้น ลาบ ต้มแซ่บ แกงอ่อม อาหารตามสั่ง,19.0876504,98.9031182,9:00,19:00,Chiang Mai
สวนอาหาร&บ่อตกปลาสวนสมบูรณ์,19.1030624,98.9266637,9:00,21:00,Chiang Mai
Mae Supat Northern Cuisine,19.079333,98.9376878,9:00,17:00,Chiang Mai
ปงตอง Co-Thinking Space,19.1914837,98.8036642,9:00,18:00,Chiang Mai
ร้านน้องมดใส เเก่งกื้ด,19.2203013,98.8405439,9:30,18:00,Chiang Mai
Doux Home Cafe @Maetaman อาหารและเครื่องดื่ม,19.2004669,98.8882707,7:30,16:30,Chiang Mai
หนานแดงเย็นตาโฟ แม่แตง,19.1090613,98.937823,8:00,16:00,Chiang Mai
Moca Coffee,19.1057116,98.9367905,8:00,18:00,Chiang Mai
ก๋วยเตี๋ยวเนื้อช่อแลรสเด็ด,19.1455125,99.0114009,8:30,16:00,Chiang Mai
จ๊าดลำ ก๋วยเตี๋ยวอาหารตามสั่ง กาแฟสด ถนนแม่แตง-เชียงดาว-ฝาง,19.1326061,98.9489339,7:00,16:30,Chiang Mai
ร้านโบว์บัวแก่งกื้ด,19.2202642,98.8411835,9:00,18:30,Chiang Mai
อากาเว่ คาเฟ่,19.1909013,98.9589856,9:00,15:00,Chiang Mai
ร้านอาหารสี่พี่น้อง ตามสั่ง,19.1792565,98.9150864,8:00,16:00,Chiang Mai
ครัวคุณยายแก่งกื้ด,19.2205801,98.8443607,10:00,18:00,Chiang Mai
ร้านนงเยาว์จงเจริญ,19.17689,98.9510709,7:00,16:00,Chiang Mai
ร้านส้มตำจินตหรา(ส้มตำลุงคำ),19.0791566,98.9377595,7:02,16:00,Chiang Mai
ร้านลาบลุงเมฆ,19.1274974,98.9501908,8:00,20:00,Chiang Mai
JUST-FOR-REST,19.2207428,98.8436168,10:00,22:00,Chiang Mai
ร้านป้าเพ็ญ,19.1400304,98.9238582,9:00,16:00,Chiang Mai
ร้านเอ็ดดี้&ดี่ด้า แก่งกื้ด,19.2203829,98.8412352,0:00,6:00,Chiang Mai
ร้านเอ็ดดี้&ดี่ด้า แก่งกื้ด,19.2203829,98.8412352,8:00,0:00,Chiang Mai
ร้านอาหารเหนือสมเดช รสเด็ด ราคาประหยัด,19.0912532,98.9221043,8:00,19:30,Chiang Mai
ร้านอาหารตามสั่ง ก๋วยเตี๋ยว (ป้าวันดี),19.1802791,98.9527706,7:00,17:00,Chiang Mai
ร้านอาหารแม่สร้อย,19.2187536,98.8565178,11:00,22:00,Chiang Mai
ร้านลาบเจ๊รูญ หมูย่างกรอบ,19.1140425,98.9396119,7:30,19:00,Chiang Mai
เตี๋ยวเรือ ศาลาแดง,19.1705672,98.9276791,8:00,16:00,Chiang Mai
ร้านก๋วยเตี๋ยวป้าน้อย,19.1702413,98.9486442,8:00,20:00,Chiang Mai
ร้านกันเองป้าญา แก่งกื้ด,19.2205693,98.8441146,8:30,16:30,Chiang Mai
ร้านอาหาร ฮ่มไม้ ฮิมห้วย,19.2064483,98.8854324,8:00,16:00,Chiang Mai
ร้านหัวขัว แก่งกื้ด,19.2202257,98.8474403,8:00,21:30,Chiang Mai
ร้านเจ้าพัก,19.2207077,98.9726694,0:00,6:00,Chiang Mai
ร้านเจ้าพัก,19.2207077,98.9726694,9:00,0:00,Chiang Mai
ร้านเจ๊เมย์แก่งกื้ด,19.2202094,98.8406384,8:30,18:30,Chiang Mai
สวนอาหารครัวดอยหล่อ,18.4766291,98.7901746,10:00,23:00,Chiang Mai
ต๊ะต่อนยอน Eatery&Cafe',18.4876046,98.8073874,8:00,20:00,Chiang Mai
บรรทุก คาเฟ่ - Buntook Cafe,18.5074165,98.829572,7:30,17:00,Chiang Mai
ร้านคาวบอยคอฟฟี่ ดอยหล่อ เชียงใหม่,18.5019745,98.8230076,8:00,17:00,Chiang Mai
แม่ใส ส้มตำ,18.5159977,98.8351902,9:00,17:00,Chiang Mai
ข้าวเหนียวปิ้ง แม่ปาย,18.4713175,98.7894218,9:00,16:30,Chiang Mai
TIGER MOTHER CAFE,18.52502,98.853297,8:00,17:00,Chiang Mai
ต๊ะต่อนยอน Coffee Bar สาขาเฮือนไม้ สันติสุข,18.526978,98.8542993,7:00,16:00,Chiang Mai
ร้านข้าวซอยป้าพร,18.5226227,98.8560989,9:00,18:00,Chiang Mai
ร้านลาบสองพี่น้อง,18.5082396,98.8315044,8:00,17:00,Chiang Mai
CRAB BAR SEAFOOD,18.454113,98.768688,11:00,22:00,Chiang Mai
เฮือนดอยหล่อ คาเฟ่,18.4874721,98.8384668,8:00,17:00,Chiang Mai
พิมพ์ข้าวมันไก่(Pim Kaomankai),18.5247279,98.8530155,9:30,17:30,Chiang Mai
บ้านนอกคอกนา restaurant&cafe,18.5237002,98.8507832,10:00,20:00,Chiang Mai
เฮือนป้ออุ้ย,18.5557386,98.8297631,9:00,17:00,Chiang Mai
ร้านป้าเชิงดอย,18.4658221,98.8014848,8:00,18:00,Chiang Mai
ร้านลาบลุงบุญ สาขาดอยหล่อ,18.4968832,98.8163187,7:30,19:00,Chiang Mai
ร้านแซ่บวันหยุด,18.4953036,98.8143136,9:00,16:00,Chiang Mai
BAR BEER CAFE',18.4587525,98.7760766,17:00,0:00,Chiang Mai
ใส้อั่ว ยายพร,18.5115105,98.8546536,0:00,24:00:00,Chiang Mai
บะหมี่ขาหมูดอยหล่อ,18.4873141,98.8068709,8:00,19:00,Chiang Mai
ไอติมบ้านลุงสิงห์,18.4569669,98.7675501,8:30,20:00,Chiang Mai
ร้านอาหารตามสั่ง ก๋วยเตี๋ยว,18.4635143,98.7816618,0:00,24:00:00,Chiang Mai
ร้านก๋วยจั๊บร่มโพธิ์,18.5613159,98.8241707,9:00,15:30,Chiang Mai
ร้านขนมจีนน้ำย้อยน้องฟาง,18.4904246,98.8148497,7:00,14:00,Chiang Mai
เจ๊นุชเหล้าหวาน ส้มตำ ยำทะเล,18.509163,98.8321752,0:00,24:00:00,Chiang Mai
อาคุงเจี๊ยบ อาหารตามสั่ง,18.4548506,98.799089,8:00,17:00,Chiang Mai
ร้านหนานแดงเย็นตาโฟ,18.5234699,98.851279,9:00,17:00,Chiang Mai
ร้านทิวเมฆ อาหารตามสั่ง,18.5218009,98.8487205,11:00,22:00,Chiang Mai
ครัวลุงนัท,18.5238225,98.8507228,10:00,20:00,Chiang Mai
ร้านอาหาร ราคาถูก สะอาด อร่อย,18.4916704,98.8109735,10:00,17:00,Chiang Mai
ร้านอาหารตามสั่ง แม่วัน,18.5123121,98.8542999,9:00,17:00,Chiang Mai
ครัวฝ้ายเฟิน,18.4639223,98.78615,10:00,0:00,Chiang Mai
ก้อย​ อาหาร-เครื่อง​ดื่ม,18.5205852,98.7734735,6:00,20:00,Chiang Mai
"ครัวแม่เป็ง ลาบ,อาหารตามสั่ง",18.4513591,98.7490499,10:00,19:00,Chiang Mai
ร้านส้มตำผัดไทยเจ๊โบว์ ดอยหล่อ,18.5114777,98.8362878,9:00,17:00,Chiang Mai
ร้านข้าวหอม,18.4957609,98.8152379,8:00,17:30,Chiang Mai
ครัวบ้านสวน,18.4895818,98.7903426,9:30,20:30,Chiang Mai
ร้านก๋วยเตี๋ยวแม่กระต่าย,18.4845622,98.8014797,11:00,15:00,Chiang Mai
ร้านปลาเผาน้ำจิ้มรสเด็ด,18.5089469,98.831902,14:00,20:00,Chiang Mai
บีบี ก๋วยเตี๋ยว,18.4553784,98.7707829,9:00,16:00,Chiang Mai
ยายปัน อาหารตามสั่ง,18.5091214,98.8328764,8:00,15:00,Chiang Mai
ตำแซ่บ ปากสั่น,18.5348946,98.8040783,9:00,0:00,Chiang Mai
ร้านนมทีมิลค์,18.4851032,98.8046713,8:00,16:30,Chiang Mai
ร้านข้าวมันไก่ไหหลำ สาขาดอยหล่อ,18.4852984,98.8041586,6:30,14:00,Chiang Mai
ครัวบ้านบ้าน - Krua Baan Baan,18.4911738,98.8104751,8:00,17:00,Chiang Mai
ร้านลาบลุงหนวด,18.4884934,98.8080948,8:00,21:30,Chiang Mai
ตำแซ่บฮ้านัว,18.5230454,98.8509068,10:00,20:00,Chiang Mai
ครัวคุณปุ๊ก อาหารตามสั่ง,18.5616901,98.8169932,7:30,19:00,Chiang Mai
ครัวเฟื่องฟ้า,18.4103305,98.6744353,9:00,21:00,Chiang Mai
พี่อ้อม ส้มตำ หนังไก่ย่าง,18.4800786,98.8089464,8:00,16:30,Chiang Mai
หนานแดง เย็นตาโฟ ดอยหล่อ,18.5266271,98.8544246,10:00,20:30,Chiang Mai
ป้าแก้ว​ ก๋วยเตี๋ยว-น้ำเงี้ยว,18.512972,98.8385305,9:00,17:00,Chiang Mai
ร้านพี่มะลิ,18.5098985,98.8339776,6:00,20:00,Chiang Mai
จำปาแคนตาลูป อาหารตามสั่ง,18.489339,98.8090524,9:00,15:00,Chiang Mai
ร้านก๋วยเตี๋ยวยายมูล,18.507051,98.8455571,8:00,15:30,Chiang Mai
มาเต๊อะเต๋วไก่ตามสั่ง noodles alacart ThaiFood,18.5237141,98.8507858,8:00,17:00,Chiang Mai
ร้านกะเพราหอม (KAPROWHOM)​,18.5199966,98.8468316,8:00,15:30,Chiang Mai
ข้าวแกงแม่แดง,18.4848576,98.804251,6:00,18:00,Chiang Mai
ข้าวมันไก่โกยิม,18.4994647,98.8442866,10:00,15:00,Chiang Mai
ร้านลาบแม่ขาน,18.5216738,98.8486248,9:00,20:00,Chiang Mai
ร้านไก่ย่างบ้านสามหลัง,18.5201735,98.8470914,8:00,18:00,Chiang Mai
ร้านขาหมูบางรัก จิงจูไฉ่,18.5115105,98.8364038,7:00,17:30,Chiang Mai
เอ๋ ก๋วยเตี๋ยว ข้าวซอย,18.4644617,98.7826925,9:00,17:00,Chiang Mai
ก๋วยเตี๋ยวไก่ อาหารตามสั้ง,18.5235764,98.850699,8:00,17:30,Chiang Mai
Mountian guys cafe',18.4534826,98.7850371,8:00,18:00,Chiang Mai
ร้านก๋วยเตี๋ยวเก๊าลำไย บ้านไร่วรรณใหม่,18.516897,98.83136,9:00,15:00,Chiang Mai
อาหารตามสั่ง ขนมจีนน้ำเงี้ยว ส้มตำ ยำแซ่บ,18.5086717,98.8496513,9:00,20:30,Chiang Mai
ก๋วยเตี๋ยวพี่น้อง,18.450774,98.7769088,8:00,16:00,Chiang Mai
ร้านหมูกะทะ ป.แป้ง,18.5006923,98.8213882,17:00,23:00,Chiang Mai
ร้านข้าวหอม กับข้าวถุง 20 บาท รับทำปิ่นโต,18.4849835,98.8059266,15:00,19:00,Chiang Mai
เตี๋ยวตุ้ด (ตามสั่ง),18.578873,98.7934429,10:00,16:00,Chiang Mai
ร้ายก๋วยเตี๋ยวแม่ขาน&นิวนิวส์ข้าวซอย,18.515126,98.841111,6:00,15:30,Chiang Mai
ก๋วยเตี๋ยวดวง แม่ขาน,18.5280475,98.8559265,8:00,16:30,Chiang Mai
หมูปิ้ง​เนปาล(หมูปิ้งหน้าเซเว่นแม่ขาน)​เชียงใหม่,18.5249161,98.8526634,4:30,11:30,Chiang Mai
เดอ เอิง บูติค,18.4581873,98.7748452,12:00,12:00,Chiang Mai
ก๋วยเตี๋ยวเป็ดไก่พะโล้,18.5242968,98.8514329,9:30,17:00,Chiang Mai
ร้านก๋วยเตี๋ยวป้ามล​ ยางคราม,18.5576359,98.8296665,9:00,17:00,Chiang Mai
ร้านก๋วยเตี๋ยวลุงถม กะเพราถาด ตรงข้ามปั้ม PT แม่ขาน,18.5256278,98.8534015,10:00,21:00,Chiang Mai
ลาบเก๊าหูกว๋าง & อาหารตามสั่ง,18.509087,98.8320802,8:00,19:00,Chiang Mai
ร้านอาหารป้าส้มป้าแมวสะเมิง,18.8336783,98.7328646,7:00,19:00,Chiang Mai
นกน้อยหมูกะทะ สะเมิง,18.840756,98.7317658,17:00,21:30,Chiang Mai
ครัวสะเมิงลาบหัวโต้ง,18.8585661,98.7309499,8:00,18:00,Chiang Mai
ครัวคนเมือง,18.8475044,98.7315362,9:00,21:00,Chiang Mai
ความสุข khwamsukh cafe,18.8458751,98.5683643,7:00,18:30,Chiang Mai
SUPANNEE RESTAURANT,18.84775,98.7330667,9:00,18:00,Chiang Mai
รุ่งนภา ลาบ,18.8490389,98.7270903,8:00,17:00,Chiang Mai
yentafo yok lo,18.8640673,98.7234676,7:30,16:00,Chiang Mai
แลงมาเซ,18.8615017,98.7270351,11:00,0:00,Chiang Mai
ร้านครัว บ่อแก้ว,18.8472259,98.5683551,7:00,20:00,Chiang Mai
Oui Kaew Coffee อุ้ยแก้วกาแฟ,18.8523299,98.7328733,8:00,17:00,Chiang Mai
Valley Coffee By Lanna Resort,18.7576585,98.8804627,10:00,19:00,Chiang Mai
ร้านต๋ำส้มฮ่อมน้อยๆ อร่อยเวอร์,18.9265265,98.7531651,10:00,18:00,Chiang Mai
บ้านสะเมิง Baan Samoeng,18.8526187,98.7327125,8:30,18:00,Chiang Mai
กาแฟสะเมิง,18.7245882,98.9254068,9:00,18:00,Chiang Mai
หลองข้าวสะเมิง,18.8435598,98.7316849,14:00,12:00,Chiang Mai
ไส้อั่วป้าตุ๋ยยาวที่สุดในโลก,18.5159977,98.8351902,8:00,17:00,Chiang Mai
The Doi Resort and Restaurant,18.7991068,98.8320474,7:00,19:30,Chiang Mai
The Nest at Samoeng doinok resort,18.8553116,98.6939209,10:00,19:00,Chiang Mai
อาหารเหนือพื้นบ้าน ศูนย์เศรษฐกิจชุมชนอำเภอจอมทอง,18.4799528,98.6716253,9:00,20:30,Chiang Mai
ร้านพาขวัญ ปูไข่จอมทอง,18.4154856,98.6811009,11:00,22:00,Chiang Mai
ร้านวันฟิช,18.4085452,98.7049497,10:00,0:00,Chiang Mai
Kruabanrao ​,18.4429596,98.6774568,8:00,21:00,Chiang Mai
ร้านส้มปาก,18.4117126,98.7077037,10:00,20:00,Chiang Mai
ลาบปลาจอมทองครัวแม่จินดา,18.4038502,98.7018987,9:00,22:00,Chiang Mai
ส้มตำเฮือนไม้,18.431708,98.6766087,8:00,17:00,Chiang Mai
ครัวอินทนนท์,18.5355539,98.5221419,6:00,21:30,Chiang Mai
ร้านทับทิมทองปลาเผา กลางทุ่ง,18.4438978,98.7180852,10:00,22:00,Chiang Mai
แจ่วฮ้อนชาววัง,18.4370843,98.679108,10:35,21:30,Chiang Mai
เฮือนคุณย่า ก๋วยเตี๋ยวต้มยำทะเลสุดแซ่บ,18.4364189,98.6785911,7:30,18:30,Chiang Mai
ร้านปลาสาละวิน,18.434009,98.6829328,10:00,22:00,Chiang Mai
ส้มตำบ้านสวนจอมทอง,18.4517123,98.7327566,8:00,19:00,Chiang Mai
ร้าน 3ป.ข้าวซอยจอมทอง,18.4123411,98.6654338,10:30,18:00,Chiang Mai
ร้านก๋วยเตี๋ยวอภัย,18.4272304,98.6763482,7:30,16:00,Chiang Mai
ผามปลาจอมทอง&กินเต็กกัน,18.4476303,98.6945802,11:00,21:00,Chiang Mai
ข้าวต้ม นิยมจอมทอง,18.4192844,98.6778698,17:00,0:00,Chiang Mai
ครัวข้าวซอยขาใหญ่,18.4499185,98.7119292,7:30,17:00,Chiang Mai
ร้านอาหารสวัสดิการโครงการหลวงอินทนนท์,18.5439797,98.5177949,9:00,17:00,Chiang Mai
ลาบปลาสะดุ้ง 2,18.4039267,98.7018858,9:00,22:00,Chiang Mai
ครัวโคบาล,18.4399315,98.6791127,10:00,19:30,Chiang Mai
ร้านแอ๋ม ลาบปลา,18.399395,98.699272,7:00,19:00,Chiang Mai
เครือวัลย์ลาบปลา,18.4035151,98.7016885,8:00,19:00,Chiang Mai
ครัวต้นตาล จอมทอง เชียงใหม่,18.4197415,98.671309,10:00,15:00,Chiang Mai
ร้านอาหารสันลมจอย,18.4356314,98.6862923,9:30,21:00,Chiang Mai
22 Aquarius Glamping Cafe',18.5431054,98.5228847,8:00,17:30,Chiang Mai
ราชาข้าวซอย,18.4334876,98.6847876,6:30,17:00,Chiang Mai
ราดหน้าทิพย์รส,18.4285723,98.6814586,9:30,21:00,Chiang Mai
ร้านข้าวต้มชาววังสาขาจอมทอง,18.4341778,98.6857176,17:00,2:00,Chiang Mai
Wanwaan วันวาฬค่าเฟ่,18.4785604,98.6632509,8:30,17:00,Chiang Mai
รวมมิตรป้าก่ำ,18.4177396,98.6772938,9:00,20:00,Chiang Mai
ข้าวซอยแก้วน้อย,18.41741,98.6771238,6:00,15:00,Chiang Mai
มายเวียดนาม สาขาจอมทอง,18.4209611,98.6779996,10:30,20:00,Chiang Mai
ร้าน 3 อ.ส้มตำ (3OrSomtum),18.4244212,98.6790941,10:00,19:00,Chiang Mai
ร้านลองกินยำ,18.4288562,98.6806701,8:30,17:00,Chiang Mai
ลาบปลา ริมปิง,18.3994195,98.6991991,10:00,21:00,Chiang Mai
NGEGGEE เง็กกี,18.4201735,98.6772164,8:00,17:30,Chiang Mai
ร้านแม่สาย ส้มตำ อาหารพื้นเมือง,18.4143008,98.6842229,8:00,17:00,Chiang Mai
ก๋วยเตี๋ยวเรือวารี จอมทอง,18.4357556,98.6864082,8:30,15:30,Chiang Mai
ร้านคนเหนือ,18.4945961,98.6686521,8:00,17:00,Chiang Mai
ร้านอาหารบ้านสองพี่น้อง,18.449912,98.674973,10:00,21:30,Chiang Mai
ห้องอาหารเรือนเพชร,18.486949,98.6722134,9:30,17:30,Chiang Mai
Young Folk Bean & Brew,18.4151452,98.681412,8:00,17:00,Chiang Mai
หนึ่งเตี๋ยวเรือยกซด,18.451882,98.7305045,9:00,17:00,Chiang Mai
Sweetcup Coffee&Homebaked,18.4282841,98.6785075,9:00,16:00,Chiang Mai
ร้านลาบลุงเดช จอมทอง,18.4058174,98.6750368,8:00,18:00,Chiang Mai
ร้านจิ๊บเบิร์ดน้ำตกแม่กลาง,18.4947357,98.6683567,8:00,17:00,Chiang Mai
มีดี ชาบู บุฟเฟต์,18.4160626,98.6771487,17:00,22:00,Chiang Mai
ชาบูหมูโหด,18.4397172,98.6894905,10:00,22:00,Chiang Mai
อาหารพื้นเมือง อาหารตามสั่ง,18.5302325,98.5222942,5:00,20:00,Chiang Mai
ร้านบ้านข้าวหมกอิสลาม,18.4210428,98.6760456,0:00,24:00:00,Chiang Mai
ข้าวซอย กะโหล้ง,18.4359593,98.6801413,8:00,17:00,Chiang Mai
รสอ๋องลูกชิ้นยักษ์,18.4168504,98.6769504,16:00,3:00,Chiang Mai
Huge Bar,18.434895,98.6819,17:00,22:00,Chiang Mai
ร้านอาหารแสงจันทร์ จ๋อมตอง,18.4345788,98.6818318,18:00,1:00,Chiang Mai
ชาบูคุณชาย บุฟเฟ่ต์สายพานจอมทอง,18.4159401,98.6768142,11:00,21:00,Chiang Mai
Cobal Hut,18.43627,98.680486,18:00,23:45,Chiang Mai
ยำปูเจ็ดยอด สาขาจอมทอง,18.4259429,98.6811097,10:00,21:00,Chiang Mai
ครัวนานา,18.3226021,98.6650586,11:00,21:00,Chiang Mai
ร้านข้าวต้มหนานทีมจอมทอง,18.4355118,98.6811307,16:00,23:00,Chiang Mai
เบส​แซลมอน​จอมทอง,18.4035797,98.6764972,11:00,13:00,Chiang Mai
เบส​แซลมอน​จอมทอง,18.4035797,98.6764972,16:30,21:30,Chiang Mai
ป้าณี ผัดไทย,18.4169529,98.6770805,16:30,22:30,Chiang Mai
ภิภูชาบู,18.4288629,98.682057,12:00,22:00,Chiang Mai
ข้าวมันไก่ ป.7 สาขาจอมทอง,18.4308473,98.683272,6:30,16:00,Chiang Mai
ครัวต้นหลิว,18.404424,98.6518186,8:00,17:00,Chiang Mai
ลาบปลา จอมทอง,18.4050318,98.7013359,8:30,0:00,Chiang Mai
ร้านข้าวต้มปลา - ก๋วยเตี๋ยวปลา,18.4300954,98.6827834,17:00,22:00,Chiang Mai
ร้านเอ๊กซ์เบเกอรี่,18.4169211,98.6770582,9:00,17:00,Chiang Mai
ร้านเอเอหมูกะทะ,18.4345596,98.6822534,17:00,22:00,Chiang Mai
ร้านแม่กลางชวนชิม,18.4950597,98.6677945,8:00,17:00,Chiang Mai
ร้านลาบลุงตุ๋ยจอมทอง,18.4401329,98.6788226,7:00,20:00,Chiang Mai
ทุเรียน ร้านรจนา จอมทอง,18.4047548,98.6754311,8:00,20:00,Chiang Mai
Espresso Martini CNX (ร้านกาแฟ เอสเพรสโซ่ มาร์ตินี่ จอมทอง เชียงใหม่),18.4283754,98.6813849,8:00,17:00,Chiang Mai
ร้านก๋วยเตี๋ยวพรศรี เลิศรส,18.4276184,98.6810003,8:00,16:00,Chiang Mai
ร้านธนปลาแม่น้ำสาละวิน,18.4340139,98.6829348,10:00,21:00,Chiang Mai
ลาบปลาแม่เครือวัลย์ สาขา 2,18.4050353,98.7011571,9:00,18:30,Chiang Mai
SP หมูกระทะ,18.4334279,98.6828037,17:00,22:00,Chiang Mai
หมูหมึกกุ้งby PP จอมทอง,18.4359178,98.6784845,10:30,21:00,Chiang Mai
ร้านก๋วยเตี๋ยวแก้มป่อง จอมทอง,18.4160391,98.6798466,7:00,16:00,Chiang Mai
จักรพรรดิ หม่าล่าชาบู สาขาจอมทอง เชียงใหม่,18.4250117,98.6761073,16:00,22:00,Chiang Mai
ร้านก๋วยเตี๋ยวลิ้นวัว นครสวรรค์ (จอมทอง เชียงใหม่),18.4397653,98.6895186,8:30,15:30,Chiang Mai
ผัดไทย โบราณ,18.4210665,98.6780656,17:00,21:00,Chiang Mai
ร้านลุงอ้วน,18.3070989,98.6481241,10:00,20:00,Chiang Mai
Coffee​ CONS.,18.2106815,98.615937,8:00,16:00,Chiang Mai
ชาบู สตอรี่ ยู,18.4342174,98.6820678,11:00,22:00,Chiang Mai
ไอดิน ก๋วยเตี๋ยวต้มยำ อ.จอมทอง จ.เชียงใหม่,18.43445,98.681811,11:00,23:30,Chiang Mai
ต้อม เตี๋ยวเรือยกซด สาขาจอมทอง,18.4350512,98.6816045,8:30,16:30,Chiang Mai
