name,lat,lon,open,close,province
Nuea Yang Cafe & Yakiniku - เนื้อย่าง คาเฟ่,18.770585,98.978344,16:00,0:00,Chiang Mai
ส้มตำอ้อยใจ,18.6238662,98.8873365,10:30,16:00,Chiang Mai
คากิ หม้อไฟ,18.5989568,98.8886044,16:00,22:00,Chiang Mai
ร้านข้าวซอยป่าแดด,18.5682521,98.8693305,9:30,16:00,Chiang Mai
Leysa Cafe',18.5816937,98.9339199,10:00,18:00,Chiang Mai
ข้าวมันไก่ไหหลำ สันป่าตอง,18.5959007,98.8887502,6:00,13:00,Chiang Mai
ก๊งกิ่วแล (Kong-Kiew-Lae) Bar & Restaurant,18.6346457,98.8553701,10:00,0:00,Chiang Mai
ร้านสันป่าตองคันทรี,18.623887,98.8847927,18:00,0:00,Chiang Mai
ร้านลาบบ้านไร่,18.6169116,98.9022216,10:30,15:30,Chiang Mai
ร้านอาหารลองจิมกอย,18.6278901,98.8950498,10:00,14:00,Chiang Mai
ร้านอาหารลองจิมกอย,18.6278901,98.8950498,17:30,20:30,Chiang Mai
ลาบท้องฝาย,18.5741871,98.8679873,9:00,14:00,Chiang Mai
ส้มตำหนองคายรสแซ่บ สันป่าตอง,18.6253301,98.8942423,8:30,17:30,Chiang Mai
ร้านกิ๋นจ๋นกั๊ด,18.596915,98.8886612,8:00,17:00,Chiang Mai
ครัวน้องจ๋า,18.6224441,98.8956309,6:00,20:00,Chiang Mai
ร้านส.ว. ข้าวมันไก่,18.5966594,98.8887085,6:30,15:30,Chiang Mai
ร้านกุ้งเต้นเน้นแซ่บ,18.5993869,98.9026722,15:00,21:00,Chiang Mai
ครัวสังกะสี@สันป่าตอง เชียงใหม่,18.6521686,98.8922759,9:00,17:00,Chiang Mai
ครัวป้านงค์ สันป่าตอง,18.5953308,98.8885431,10:00,20:00,Chiang Mai
ครัวยุพินไอซ์,18.5854806,98.885913,11:00,0:00,Chiang Mai
กินดิบ กินดี มีลาภ,18.5758392,98.8931882,10:00,20:00,Chiang Mai
Saran Lom Coffee & Bistro,18.601709,98.9035035,18:00,0:00,Chiang Mai
ข้าวราดแกงอร่อยแน่นอน,18.6036979,98.8910878,6:00,15:00,Chiang Mai
ครัวนายแดน,18.5775212,98.8812742,9:00,19:30,Chiang Mai
ร้านข้าวมันไก่กาญจนา,18.6241685,98.8940144,7:30,14:30,Chiang Mai
เตี๋ยว ต้นกะเตย,18.6549234,98.8626385,9:00,21:00,Chiang Mai
เสือ ไส้ย่าง,18.5611658,98.8882522,17:00,22:00,Chiang Mai
Honey Cafe and Bakery,18.6214657,98.8932262,8:00,17:30,Chiang Mai
หมูจุ่ม บุฟเฟ่99 สันป่าตอง,18.624267,98.8926945,17:00,0:00,Chiang Mai
เพลินบาร์ (Plern Bar),18.5707584,98.8777636,17:00,0:00,Chiang Mai
ชื่น-ฤไท คาเฟ่,18.5915059,98.8903282,8:00,17:00,Chiang Mai
ลาบดีขมบ้านสันทราย,18.5923063,98.9035966,8:00,16:30,Chiang Mai
ร้านลาบต้นสัก,18.6645604,98.8753008,9:00,20:00,Chiang Mai
ร้านอาหาร กินข้าวกัน & ส้มตำระยอง ส้มตำ หมูกรอบ กระเพรา อาหารตามสั่ง กระเพราหมูกรอบ รสเด็ด,18.561714,98.869132,8:00,18:00,Chiang Mai
ร้านป้าแดงใหญ่สาขา2 ทุ่งเสี้ยว,18.5652024,98.872336,17:00,23:30,Chiang Mai
ก๋วยเตี๋ยวต้นผึ้ง,18.6121576,98.8943484,8:00,16:30,Chiang Mai
ร้านทะเลต้นกอก,18.5575239,98.8739263,14:00,20:00,Chiang Mai
ครัวคุณหน่องอาหารอีสานล้านเปอร์เซ็นต์,18.5956807,98.9110254,8:00,20:00,Chiang Mai
Hana House บ้านฮานะ,18.6156027,98.8896423,10:00,17:00,Chiang Mai
ข้าวมันไก่ตายาย,18.5988084,98.8890543,6:30,15:00,Chiang Mai
W 143 ชาบู,18.5970232,98.8886368,11:30,22:00,Chiang Mai
"Chop&Cop cafe , Cheewa Clinic",18.6186226,98.8965273,6:00,18:00,Chiang Mai
ร้านเจบารมี,18.5828952,98.8811078,8:00,18:00,Chiang Mai
ร้านโกแดง อาหารตามสั่ง,18.5948752,98.8860981,6:00,20:00,Chiang Mai
บ้านน้ำเงี้ยว,18.5945921,98.9115128,9:00,14:00,Chiang Mai
Mandalay Bar Sanpathong,18.5774805,98.881263,17:00,0:00,Chiang Mai
ร้านป้าแดงส้มตำ,18.5478056,98.8849986,8:00,17:00,Chiang Mai
ร้านผัดไทยกุ้งคลอง​ สาขา​9​ สันป่าตอง,18.594566,98.88417,8:00,17:30,Chiang Mai
ก๋วยเตี๋ยวเก๊ามะขาม สันป่าตอง เชียงใหม่,18.6185732,98.897633,8:00,16:00,Chiang Mai
รัานข้าวแกงโกจุ่น,18.5687418,98.8766189,9:00,17:00,Chiang Mai
Living Cafe Bar & Restaurant ลิฟวิ่ง คาเฟ่ สันป่าตอง,18.5739144,98.8794441,18:00,0:00,Chiang Mai
โบร่ำโบราณข้าวขาหมูโคตรอร่อยสันป่าตอง,18.623815,98.8951073,7:30,16:30,Chiang Mai
ร้านป้าแมว,18.5949394,98.8863231,5:30,13:30,Chiang Mai
บ้านสวนหนูดี,18.6110684,98.885294,8:00,18:00,Chiang Mai
ร้านพี่อ้วนอาหารตามสั่ง,18.5655487,98.8717309,7:00,16:30,Chiang Mai
ร้านอาหารตามสั่ง+ ปลาเผา / บ้านเลขที่ 69 หมู่3,18.5563105,98.8859088,14:00,20:00,Chiang Mai
กุ้งเต้นหนองสะเรียม & Billy Coffee at สันป่าตอง,18.6076406,98.8893209,8:00,23:00,Chiang Mai
Carp House,18.5815816,98.8773131,7:30,5:00,Chiang Mai
ครัวฬิฬา,18.6126415,98.8513847,9:00,16:00,Chiang Mai
ไข่เจียวบุฟเฟ่ต์คุณแอ็ด,18.5660638,98.8729993,6:00,9:00,Chiang Mai
ร้านอาหารตามสั่งพี่หนิง,18.5486499,98.8842882,7:00,15:30,Chiang Mai
Anda Peka,18.5663772,98.8840498,9:00,16:30,Chiang Mai
ส้มตำลีลา,18.5951814,98.8879968,8:30,20:00,Chiang Mai
ร้านอาหารข้าวซอย,18.5731311,98.9024339,9:00,19:30,Chiang Mai
ร้านก๋วยเตี๋ยวโคตรลำ รวย,18.5758208,98.9112356,9:00,15:30,Chiang Mai
ป.ปังเย็น,18.5867151,98.918871,11:30,19:00,Chiang Mai
หมูพวง,18.595117,98.8867266,0:00,24:00:00,Chiang Mai
ร้านคอหมูย่าง บ้านกลาง,18.5588899,98.8736902,6:00,22:00,Chiang Mai
สเต็กบ้านสวน By บ้านสวนวิว,18.6171852,98.8963286,11:00,20:00,Chiang Mai
กะเพราถาดทุ่งเสี้ยว,18.5689017,98.8758352,8:00,15:00,Chiang Mai
น้อยต้อม ก๋วยเตี๋ยวควาย ณ สันป่าตอง,18.5662971,98.8742109,8:09,15:30,Chiang Mai
I am Pizza หน้า รพ.สันป่าตอง,18.5950596,98.8872815,9:00,19:00,Chiang Mai
กาแฟบ้าน บ้าน อาหารสมุนไพร,18.5833069,98.9201792,6:00,18:00,Chiang Mai
อาหารปักษ์ใต้ครัวแม่นุ้ย,18.5952851,98.8874334,7:00,15:00,Chiang Mai
ครัวจิรา แม่ออน,18.7806778,99.2424341,10:00,21:00,Chiang Mai
ไส้อั่วแม่นิ่ม,18.8650587,99.3500619,8:00,17:00,Chiang Mai
Claai Cafe' & Eatery,18.8794485,99.3451863,9:00,18:00,Chiang Mai
ณ แม่กำปอง ร้านอาหารแม่กำปอง,18.8650509,99.3499365,9:00,17:00,Chiang Mai
Kangjong Restaurant,18.8768879,99.3396597,9:00,17:00,Chiang Mai
ลาบขมแม่ออนเชียงใหม่,18.7527166,99.2274236,10:00,21:00,Chiang Mai
ระเบียงวิว @แม่กำปอง,18.8656033,99.3555487,9:00,20:00,Chiang Mai
อัญชัญ SLOW COOK แม่กำปอง,18.8652039,99.3499126,8:30,17:30,Chiang Mai
เดอะมูน คาเฟ่,18.8630221,99.3000174,9:30,21:00,Chiang Mai
แม่ออนโภชนา,18.7524244,99.2268389,9:00,21:00,Chiang Mai
ข้าวซอยกลอยใจ,18.8652348,99.3501608,8:00,20:00,Chiang Mai
ไส้อั่ว แม่ออน,18.7882423,99.2433395,8:00,18:00,Chiang Mai
Atlantis Valley,18.8785495,99.3432006,7:00,19:00,Chiang Mai
เดอะ ไจแอนท์ เชียงใหม่,18.8923728,99.3512606,9:00,17:00,Chiang Mai
ร้านหลู้ฮิมตาง,18.7557034,99.2476941,8:00,18:00,Chiang Mai
ร้านอาหารผ่อม่อน Restaurant & Campsite,18.7584357,99.2459076,10:00,22:00,Chiang Mai
1 For The Road,18.8043824,99.2380847,8:00,17:30,Chiang Mai
สวนฉัน iGarden,18.8673122,99.3090513,11:00,20:00,Chiang Mai
ก๋วยเตี๋ยว ป้ออุ้ย แม่อุ้ย,18.8650768,99.349786,11:00,23:00,Chiang Mai
ร้านเดอะดิ่ง แม่กำปอง,18.8652238,99.3498305,17:00,22:00,Chiang Mai
ร้านแม่กำปอง ป้ายแดง,18.8655212,99.3505079,10:00,22:00,Chiang Mai
ร้านเฮือนฮ่อมดอย,18.6060337,99.2724273,7:00,20:00,Chiang Mai
ร้านฮิมปาย,18.8492714,99.2620175,8:30,20:30,Chiang Mai
ครัวในสวน แม่ออน,18.7989461,99.2424386,9:00,19:30,Chiang Mai
ร้านอาหารเฌอแตม,18.7469166,99.2560102,9:00,20:00,Chiang Mai
Naga Cafe - นากา คาเฟ่,18.7564958,99.2356087,8:00,16:30,Chiang Mai
ร้าน มาดีมีเส้น,18.8131134,99.2548098,8:00,16:00,Chiang Mai
ข้าวซอยก๋าไก๋,18.5827502,99.2620067,9:00,15:00,Chiang Mai
ส้มตำโฟโต้บี,18.7659871,99.25902,10:30,17:00,Chiang Mai
ร้านตันใจ,18.8167979,99.236805,9:00,19:00,Chiang Mai
"ร้านไส้ย่าง Signature ""ซิกเนเจอร์""",18.7458323,99.2564247,16:00,0:00,Chiang Mai
ครัวแม่หลวง,18.7985356,99.2422413,8:30,22:00,Chiang Mai
ยำปูม้าเจ็ดยอดสาขาแม่ออน,18.7568523,99.2437941,10:00,21:00,Chiang Mai
ร้านข่วงยินดี,18.771189,99.2519428,17:00,2:00,Chiang Mai
ลาบปลา ลาบไก่ ลุงสว่าง,18.7483534,99.2176199,9:00,18:00,Chiang Mai
ร้านเอ็นจอยคาเฟ่(ซุ้มฮิมนา),18.7762175,99.2569347,10:30,23:30,Chiang Mai
โอดะ อะ-หร่อย-เวอร์ ณ แม่ออน,18.7500712,99.2545714,8:00,16:00,Chiang Mai
Steak Indy @ Maeon,18.748592,99.233981,10:00,20:00,Chiang Mai
บ้านฮิมห้วย ลุงปุ๊ด & ป้าเป็ง,18.8651165,99.3502152,8:00,18:00,Chiang Mai
แม่ออนข้าวขาหมู,18.7928033,99.2440966,7:00,3:30,Chiang Mai
ร้านฮ่อมดอย แม่ออน,18.7955143,99.2443156,10:00,21:00,Chiang Mai
เฮือนกาแฟ อาหารและเครื่องดื่ม,18.8656846,99.3534927,8:00,18:00,Chiang Mai
บ้านอิงดาว แม่กำปอง,18.8657723,99.3555896,8:00,17:00,Chiang Mai
ร้านข้าวซอย เเม่เนียน,18.8598428,99.275249,8:30,16:30,Chiang Mai
ปังปิ้งเตาถ่านMaekampong,18.8650391,99.3496296,9:00,17:00,Chiang Mai
Maetha Organic Cafe,18.5873564,99.2641512,9:00,17:00,Chiang Mai
เฮือนหม่อนแก้ว,18.8652485,99.3511888,9:00,18:00,Chiang Mai
ร้านอาหารตามสั่งยายใส,18.7519859,99.2358177,8:00,17:00,Chiang Mai
Him Tang Pig's Blood Soup,18.7557443,99.2475594,10:00,21:00,Chiang Mai
เด็กอ้วนแซ่บแม่ออน,18.7419982,99.207953,9:30,20:30,Chiang Mai
ร้านบัณฑิตไส้อั่วตับบอกต่อ อ.แม่ออน,18.7540121,99.2390748,9:00,18:00,Chiang Mai
ครัวผอมเพียว เฮือนมณีจันทร์,18.7839759,99.2429374,0:00,24:00:00,Chiang Mai
Survey-เซอร์เวย์ @ maeon,18.795516,99.2452904,9:00,16:00,Chiang Mai
เทดดู้คอฟฟี่ แม่กำปอง,18.8656082,99.3473739,9:00,17:00,Chiang Mai
ระเบียง ไทร แอนด์ ลุง,18.7544187,99.2510919,10:30,22:00,Chiang Mai
ร้านก๋วยเตี๋ยว ข้าวซอยป้าปุ๊,18.7976569,99.2436713,9:00,16:00,Chiang Mai
Somen&Co โซเมนรางน้ำ แม่ออน,18.808503,99.2370665,11:00,20:00,Chiang Mai
ผัดไทยณิชา2ทางไปแม่กำปองห้วยแก้วแม่ออนตรงข้ามปั้มPT,18.8571336,99.2671447,10:00,19:00,Chiang Mai
ร้านขนมจีน แม่ศรีไพ,18.7560549,99.2469974,8:00,15:00,Chiang Mai
ร้านอ้วนจัง บ้านป่าห้า ออนใต้,18.725297,99.1987417,10:00,18:00,Chiang Mai
ชิกเก้นมิวส์แม่ออน,18.7969259,99.2439932,16:00,21:00,Chiang Mai
ขนมจีนริมออนปลีกส่ง,18.7414379,99.2084899,7:00,18:00,Chiang Mai
ร้านก๋วยเตี๋ยวเนื้อ ออนกลาง,18.7720871,99.2572702,8:00,20:00,Chiang Mai
TEA Nature Cafe (plant based) ที่พักแม่ออน,18.772363,99.240352,9:00,18:00,Chiang Mai
ร้านก๋วยเตี๋ยว ลุงศักดิ์ป้าไก่ บ้านหัวฝาย,18.7964776,99.2600405,7:00,19:30,Chiang Mai
ร้านส้มตำคุณแม่ : หมู่บ้านแม่เลน,18.7527615,99.2361845,8:00,17:30,Chiang Mai
ห้วยโป่งฟาน,18.7436094,99.2032095,9:00,19:00,Chiang Mai
ทีสตอรี่ แม่กำปอง,18.8674403,99.3085028,0:00,24:00:00,Chiang Mai
ข้าวขาหมูแม่ออน,18.7470942,99.1160332,8:00,19:00,Chiang Mai
Tawan Riverside Resort Restaurant Cafe,18.6397342,98.6989135,10:30,20:30,Chiang Mai
Baan Najin,18.5991189,98.8196279,9:00,16:00,Chiang Mai
หนานแดงเย็นตาโฟ,18.6039993,98.8303899,8:00,0:00,Chiang Mai
De Ba No Mee Bar & Restaurant,18.6676751,98.6349381,0:00,24:00:00,Chiang Mai
De Ba No Mee Bar & Restaurant,18.6676751,98.6349381,11:00,0:00,Chiang Mai
ร้านBaanMae at Maewang,18.599775,98.8143867,8:00,16:00,Chiang Mai
ครัวกินเพลิน ปลาจุ่ม แม่วาง,18.6059883,98.8360557,11:00,21:00,Chiang Mai
Restaurant Huay Kiang ร้านอาหาร ห้วยเกี๋ยง,18.6901974,98.5663741,9:00,16:00,Chiang Mai
Blessing camp cafe,18.597006,98.8126283,9:00,17:00,Chiang Mai
Blessing camp cafe,18.597006,98.8126283,7:30,18:00,Chiang Mai
Maewang elephant cafe @ River,18.6560709,98.685375,9:30,17:00,Chiang Mai
Wanwan Baanya Cafe',18.6047998,98.8324257,10:30,21:00,Chiang Mai
Daily in Cafe Maewang Chiangmai,18.6017088,98.8252187,8:30,21:30,Chiang Mai
ร้านใบเฟิร์น ล่องแพแม่วาง,18.6316539,98.7093328,8:00,18:00,Chiang Mai
Huan Hom Rada,18.644891,98.6975544,8:00,17:00,Chiang Mai
ร้านน้องผึ้ง ล่องแพ แม่วาง,18.6391452,98.6997459,8:00,19:00,Chiang Mai
ร้านลาบเก๊างิ้ว,18.6015322,98.8259602,9:00,19:00,Chiang Mai
ร้านป้าแต้ล่องแพแม่วาง bamboorafting,18.6382169,98.7018316,9:00,18:30,Chiang Mai
ร้านโกปึ้งปางช้างแม่วาง,18.6383061,98.7008909,8:00,18:00,Chiang Mai
ซะป๊ะตำส้ม,18.6639567,98.8260533,11:00,23:00,Chiang Mai
สว.ข้าวมันไก่ สาขาบ้านกาด,18.6045146,98.8315701,7:00,14:00,Chiang Mai
ร้านอาหารแม่ทำ ก๋วยเตี๋ยว ข้าวซอยรสเด็ด,18.6173155,98.7690032,10:00,16:00,Chiang Mai
ร้านอาหารสวนริมขาน,18.6272924,98.8286543,8,18,Chiang Mai
ล่องแพแม่วางร้านโสภาทรัพย์,18.6382668,98.701507,9:00,19:30,Chiang Mai
ร้านอู่ทอง,18.6170261,98.7695276,7:30,17:00,Chiang Mai
ร้านแม่วางลาบลำ,18.6192483,98.7636023,8:00,19:00,Chiang Mai
Weekend Chiangmai,18.6027704,98.8288314,18:00,0:00,Chiang Mai
Jasmine garden,18.6448901,98.6977102,8:00,17:00,Chiang Mai
ร้านมอกก๋ำปอ,18.6101398,98.8217904,8:00,17:00,Chiang Mai
ร้านแม่หลวงแขก,18.6250441,98.7163314,9:00,18:00,Chiang Mai
ร้านลาบพิมใจ (ป้าดีหกแยกเจ้าเก่า),18.5991744,98.8158758,0:00,24:00:00,Chiang Mai
ร้านอาหารริมธารโฮมสเตย์แม่วิน RIMTHARNN RESTAURANT MAEWIN,18.6559289,98.6816382,8:30,20:00,Chiang Mai
ร้านน้องเจล่องแพแม่วาง bamboorafting maewang,18.6381166,98.7026807,8:00,20:00,Chiang Mai
ครัวกันต์เอง,18.602332,98.8260927,9:00,20:00,Chiang Mai
ลาบ ลำ ดี - หลังไปรษณีย์แม่วาง,18.5994389,98.814462,10:00,23:00,Chiang Mai
ร้านลาบขมสมคิด แม่วาง,18.6263688,98.8291263,9:00,17:00,Chiang Mai
ซุ้ม กำนันพร,18.626563,98.71437,9:00,18:00,Chiang Mai
ร้านเฮียเบ้น บ้านทุ่งศาลา อ.แม่วาง,18.6626838,98.818956,9:00,21:00,Chiang Mai
กิน-เต็ก-กัน@แม่วาง,18.6026106,98.8288504,10:30,20:00,Chiang Mai
PizzaYou,18.603273,98.8297401,10:30,17:30,Chiang Mai
ร้านบ้านบนอินดี้,18.606257,98.8165514,9:00,15:00,Chiang Mai
ครัวร่มไม้,18.6370567,98.703955,9:00,20:00,Chiang Mai
ส้มตำแรมจันทร์,18.6019919,98.8259857,10:00,19:00,Chiang Mai
บ้านตัว​ ป.,18.6104199,98.8320591,9:00,17:00,Chiang Mai
มา เมืองวิน,18.6615267,98.6612676,8:00,18:00,Chiang Mai
Farm Sook Homemade Kitchen,18.6454525,98.6966479,9:00,22:00,Chiang Mai
ร้านสามพี่น้อง อาหารตามสั่ง,18.7884631,98.5470454,8:00,16:00,Chiang Mai
ร้านปลาเผาปากทางสันโป่ง,18.604655,98.8321646,0:00,24:00:00,Chiang Mai
ครัวใต้หลอง 2,18.6038625,98.8300781,10:30,20:00,Chiang Mai
ร้านก๋วยเตียวโกเด้ง(แม่วาง),18.6007922,98.8234101,9:30,21:00,Chiang Mai
สวนอาหารขุนวาง,18.6278849,98.5056278,8:30,18:00,Chiang Mai
Mae Win Road Restaurant,18.6699206,98.5510615,9:00,20:30,Chiang Mai
ขนมจีนบ้านดาว,18.607182,98.821009,7:00,17:00,Chiang Mai
ร้านพี่ยาล่องแพแม่วาง,18.6381483,98.7023648,8:00,19:00,Chiang Mai
ก๋วยเตี๋ยวแม่ตุ๋ย,18.669765,98.6441381,7:00,16:00,Chiang Mai
INNLAND 83 Cafe',18.6095414,98.8295867,9:00,0:00,Chiang Mai
ร้านข้าวมันไก่กาญจนา แม่วาง,18.6037925,98.8308783,7:00,17:00,Chiang Mai
ก๋วยเตี๋ยวควายbyเจเจ,18.6014937,98.8248588,8:00,15:00,Chiang Mai
ร้านข้าวมันไก่ไหหลำมาดามมิว,18.6010242,98.8239194,7:00,14:00,Chiang Mai
Baan Kao Coffee,18.562882,98.8435455,9:00,17:00,Chiang Mai
ร้านอาหานเจ๊แดงตามสั่ง,18.5990387,98.8214954,7:00,14:00,Chiang Mai
ร้านน้องกอย ลาบหลู้(แม่วางโกปึ้งเจ้าเก่า),18.6035429,98.8112598,7:00,20:00,Chiang Mai
ร้านลาบรังสรรค์ เชียงรายรำลึก,18.5986945,98.820952,9:00,20:00,Chiang Mai
ร้านอาหารตามสั่งเจ๊เก๋,18.60813,98.5087458,9:00,17:00,Chiang Mai
ไข่ลวกกาแฟ-แยกแม่วาง ม่อนมาลี,18.605537,98.8340861,5:00,9:00,Chiang Mai
ก๋วยเตี๋ยวลูกชิ้นยักษ์ ร้านน้องมีตังค์,18.6027457,98.8278697,9:00,23:30,Chiang Mai
Crepe baanbaan,18.6004434,98.8226073,17:00,21:00,Chiang Mai
Catz.B Burger,18.6088056,98.8330833,11:00,18:30,Chiang Mai
ร้านขนมจีน-ส้มตำ ป้าอ้อ,18.562616,98.844523,8:00,18:00,Chiang Mai
Seoul Nice,18.6025326,98.8287406,0:00,12:00,Chiang Mai
มังกรทอง ก๋วยเตี๋ยวเรือ สาขาแม่วาง,18.6005863,98.8218058,10:00,16:00,Chiang Mai
เตญ่า ฟาร์มวิลล์,18.6080618,98.5084437,8:00,17:00,Chiang Mai
ขนมจีนป้าน้องดอนเปา,18.6050606,98.8194404,0:00,24:00:00,Chiang Mai
ผัดไทยเจ๊จี,18.6058702,98.8216198,9:00,21:00,Chiang Mai
ร้านน้องแอนยำมะม่วงปลากรอบ,18.6026179,98.8287726,15:45,23:30,Chiang Mai
ครัววันทนีอาหารตามสั่ง,18.6109886,98.8219374,9:00,18:00,Chiang Mai
ส้มตำ ขอนแก่น ไก่ย่างวิเชียรบุรี,18.600901,98.8243117,10:00,16:00,Chiang Mai
ร้านแม่คำหน้อย ล่องแพแม่วาง,18.639838,98.6995949,8:00,18:00,Chiang Mai
ย่าง ณ วันวาน,18.6047879,98.8324451,18:00,0:00,Chiang Mai
มัมหมีพุดดิ้ง(บ้านแม่แอ๊ว),18.5967308,98.8198881,8:30,17:30,Chiang Mai
รสมือเฮีย ข้าวแกงปักษ์ใต้ (สาขา 3),18.6018404,98.8252586,8:00,15:00,Chiang Mai
ร้านโกหมู,18.6125421,98.8531036,9:00,18:00,Chiang Mai
ร้านข้าวแกงพุงแตก,18.5513539,98.8628672,7:30,14:30,Chiang Mai
Sky beach cafe,19.0773501,98.9090084,9:00,20:00,Chiang Mai
แซ่บในหลืบ,19.1420615,98.9159282,9:30,18:00,Chiang Mai
ร้านอาหารระเบียงช้าง Elephant Terrace Restaurant,19.1804713,98.9128765,9:00,16:00,Chiang Mai
ม่อนระมิงค์ แม่แตง เชียงใหม่,19.0635818,98.9394909,7:00,16:30,Chiang Mai
ร้านข้าวซอย อิ่ม อร่อย โภชนา,19.0799051,98.937161,7:00,15:30,Chiang Mai
Long time farm stay (Slow bar &​ Organic farm)​ ร้านกาแฟแม่แตง,19.1665866,99.0043623,9:30,18:00,Chiang Mai
ร้านครัวตายาย,19.1239777,98.9412452,8:00,20:00,Chiang Mai
The Garden's House,19.1028487,98.9986523,6:00,18:00,Chiang Mai
ร้านอาหารสุพิน,19.1609512,98.6906747,7:00,18:00,Chiang Mai
แอลลี่ คาเฟ่,19.0688143,98.9410448,10:00,17:00,Chiang Mai
ส้มตำ ป้าดี,19.1524448,98.9801384,10:30,16:00,Chiang Mai
อั้มอร่อยแก่งกื้ด,19.2203165,98.8404845,0:00,24:00:00,Chiang Mai
Jungle De Cafe กื๊ดช้าง,19.219749,98.8464812,8:30,17:30,Chiang Mai
เหยิม Café&bistro,19.1452931,99.003949,8:00,17:00,Chiang Mai
ร้านอาหารอิสาน ครัวคำแพง Krua Kham Phaeng Restaurant (Isan food),19.0331553,98.9673434,11:00,21:00,Chiang Mai
หมูทองโภชนา,19.0930288,98.9363794,6:30,15:00,Chiang Mai
ร้านปิ่นโต,19.1297308,98.949345,7:30,16:30,Chiang Mai
My Mom Cafe 1/2 @ Pai,19.2074877,98.6705414,6:00,20:00,Chiang Mai
Kramfeine : ครามเฟอีน,19.131923,99.024443,8:30,16:30,Chiang Mai
อ้วนโภชนา ลาบเมือง,19.1033769,98.8384906,7:00,18:00,Chiang Mai
บ้านนายตู่,19.1087227,98.9259687,9:00,22:00,Chiang Mai
ร้านข้าวซอยแม่นาย,19.0706258,98.9390962,8:00,16:30,Chiang Mai
ระเบียงนที,19.1436219,99.0279092,10:00,23:00,Chiang Mai
แป้นเกล็ด คอฟฟี่ ทางขึ้นปาย,19.1152336,98.7850374,8:00,17:30,Chiang Mai
เจน​ ร้านอาหารป่าป่า,19.1279361,98.9492078,10:00,22:00,Chiang Mai
ต้มเตี๋ยวยายสุคำ,19.213727,98.855457,7:00,18:00,Chiang Mai
สวนอาหารศรีแก้ว@แม่แตง Srikeaw food garden&Resteraunt,19.1556154,99.0101869,11:00,23:00,Chiang Mai
ร้านอาหารริมน้ำอิงดอย,19.245169,98.653885,0:00,24:00:00,Chiang Mai
ร้านน้องเจิน,19.1166989,99.0129852,9:00,19:30,Chiang Mai
ครัวภูสบาย,19.1780273,98.9161184,9:00,17:00,Chiang Mai
ร้านอรวรรณ(ชมทุ่ง),19.1815238,98.987741,8:00,22:00,Chiang Mai
ครัวบ้านเด่น,19.1576706,98.9800995,7:00,16:30,Chiang Mai
Mao nom @doi kued,19.2181802,98.8572674,9:00,22:00,Chiang Mai
ร้านไหมไทย,19.0925757,98.9363879,11:00,23:00,Chiang Mai
ลาบต้นขาม (Larbtonkham),19.1386903,98.9473623,8:00,19:00,Chiang Mai
ร้านพี่อ้อย,19.1219614,98.9428339,7:00,15:00,Chiang Mai
ร้านตระกูลเป็ด,19.1044467,98.9366878,9:00,17:00,Chiang Mai
ครัวสายนที,19.1499764,99.0385787,10:00,22:00,Chiang Mai
