name,lat,lon,open,close,province
ร้านก๋วยเตี๋ยว..แม่จันทร์ดี,18.4121836,98.6722118,7:00,18:00,Chiang Mai
ร้านอาหารอีสานสายใต้ ครัวบุรีรัมย์,18.4188161,98.6723328,11:00,22:00,Chiang Mai
ไก่ย่างวิเชียรบุรี สาขาจอมทอง เน้นสะอาดอร่อย,18.401446,98.6772251,7:00,16:00,Chiang Mai
แอ๊ดลาบขม,18.4168983,98.6787035,10:00,20:00,Chiang Mai
VELAR,19.3745766,98.9628991,9:00,21:00,Chiang Mai
ร้านอาหารหมู่เฮา,19.4429941,98.9817075,9:00,22:00,Chiang Mai
เสน่ห์ดอยหลวง เชียงดาว,19.3723923,98.9479172,8:00,21:00,Chiang Mai
ร้านอาหารครัวเชียงดาว,19.3724804,98.9660405,7:00,20:00,Chiang Mai
좋은하루เกาหลีคาเฟ่​Goodday​ cafe​'@Chiang​dao​,19.4022662,98.9624187,10:00,19:00,Chiang Mai
Nakara Cafe & Restaurant,19.3683599,98.9797714,9:00,19:00,Chiang Mai
chiang dao resto ร้านเชียงดาวเรสโต,19.3464603,98.9606313,10:00,21:00,Chiang Mai
Jin's,19.4007384,98.9288123,15:00,21:00,Chiang Mai
ภควา,19.382823,98.9496213,9:00,20:00,Chiang Mai
Jerns Chiangdao,19.353837,98.963682,9:30,20:00,Chiang Mai
Kha Mu Chiang Dao,19.3685058,98.9651431,8:00,16:00,Chiang Mai
ร้านเดอะเชฟ​ คิทเช่น​เชียงดาว,19.34571,98.9604563,8:00,18:00,Chiang Mai
"ผัดไทย""บ้านอะลาดิน"" Padthai Aladin Chingdao",19.4055094,98.9603517,10:30,14:00,Chiang Mai
Hug Chiangdao ฮักเชียงดาว,19.3998088,98.9294937,7:30,21:00,Chiang Mai
Atmosphere resort & cafe chiang dao,19.400233,98.9620228,8:30,17:00,Chiang Mai
ร้านข้าวเส้น Restaurant & Cafe,19.3943472,98.9297329,8:00,17:00,Chiang Mai
ขาหมู พรเพ็ญขาหมูเสวย พ.ศ.๒๔๘๙,19.3682037,98.9649847,7:00,14:30,Chiang Mai
พรเพ็ญขาหมูเสวย เชียงดาว สาขา 2,19.3436249,98.9606843,6:00,14:30,Chiang Mai
ฮ้านจาวเหนือ สาขาเชียงดาว Hanjaonuea Chiang Dao,19.3779171,98.9452592,10:30,22:00,Chiang Mai
ร้านภิรมย์ บะหมี่ยูนาน,19.7408433,98.9637585,8:30,17:00,Chiang Mai
The Cojon,19.3619487,98.965112,17:00,0:00,Chiang Mai
Hoklhong Coffee,19.3504375,98.9624375,9:00,16:00,Chiang Mai
TASANA ทสฺสน,19.3663413,98.926635,8:30,17:30,Chiang Mai
ข้าวซอยดอยนาง,19.4424995,98.9661103,9:30,15:00,Chiang Mai
บ้านญาติ เชียงดาว,19.362849,98.9639724,12:00,0:00,Chiang Mai
กาแฟฮิมน้ำ,19.2843692,98.9685144,8:00,18:00,Chiang Mai
ร้านลาบลุงคำ เชียงดาว,19.3510343,98.9627061,10:00,21:00,Chiang Mai
ร้านอาหารน้องแบมแบม สาขา2 Chiangdao restaurant,19.3466698,98.961255,7:30,20:00,Chiang Mai
ขนมจีนน้ำเงี้ยว ข้าวซอย ป้าเย็น,19.3918481,98.929839,8:00,19:00,Chiang Mai
ผัดไทยฐาปนีย์,19.4551733,98.9656562,9:00,17:00,Chiang Mai
419.homecafe,19.459594,98.9626095,8:30,16:00,Chiang Mai
ร้านต้าหยงบะหมี่เกี๊ยวยูนนานเจ้าเก่าเจ้าแรก Since 1976,19.7336697,98.9628348,9:00,20:00,Chiang Mai
เต-ชา ก๋วยเตี๋ยวไข่ไดโนเสาร์,19.3660328,98.9712547,8:00,19:30,Chiang Mai
ขาหมูเชียงดาวเจ้าเก่า,19.3421395,98.9598265,8:30,17:30,Chiang Mai
ALL DAY COFFEE,19.3757883,98.9509026,7:00,16:30,Chiang Mai
ร้านกาแฟดอยเมฆ,19.4556889,98.9646979,8:00,17:00,Chiang Mai
ร้าน ชิลล์ริมน้ำ,18.1986316,98.6164393,10:00,22:00,Chiang Mai
ร้านอาหารน้องแบ๊ง,18.1934208,98.6097069,8:00,18:00,Chiang Mai
ร้านอาหารวิไลพร,18.1955088,98.611204,8:00,20:00,Chiang Mai
ครัวคุณชุ (กม.8),18.2280625,98.5643125,8:00,17:00,Chiang Mai
ร้านครัวแต้มตาล (อุทยานแห่งชาติออบหลวง),18.2226314,98.482032,4:00,20:00,Chiang Mai
Good Morning Hod,18.1928433,98.6074038,8:30,17:00,Chiang Mai
ระเบียงสน cafe,18.1557238,98.387158,8:00,17:00,Chiang Mai
Moo & Moo E-san Restaurant Branch,18.0622029,98.5444656,7:00,20:00,Chiang Mai
ร้านป้าพินอาหารปักษ์ใต้,18.1929179,98.6083094,8:00,19:30,Chiang Mai
ร้านลาบปลาป้าดี,18.1927223,98.6046217,7:00,18:00,Chiang Mai
168 คาเฟ่,18.1933745,98.6030519,18:00,0:00,Chiang Mai
ร้านครัวฮิมเหมือง,18.1985526,98.6168176,10:00,22:30,Chiang Mai
ลาบบ้านเด่น,18.1765489,98.6319226,8:00,18:00,Chiang Mai
โกข้าวมันไก่ สาขาฮอด,18.2006049,98.6139742,6:00,14:00,Chiang Mai
ร้านยิ้มหวาน อาหารตามสั่ง,18.1992296,98.6125363,11:00,20:00,Chiang Mai
ร้านแฟนต้าซีแพฮอด,18.2281825,98.5651282,8:00,18:00,Chiang Mai
MIZU 24,18.1936613,98.6112924,7:30,18:00,Chiang Mai
เฮง เฮง อาหารตามสั่ง,18.1469334,98.3473617,8:30,17:00,Chiang Mai
ยำปูม้าเจ็ดยอดสาขาฮอด,18.1985954,98.6126321,10:00,20:00,Chiang Mai
LENSEN เล่นเส้น @ฮอด,18.1861056,98.6129835,10:00,16:30,Chiang Mai
ร้านฉัตรทิพย์กิ่วลม,18.1367399,98.3727589,8:00,17:00,Chiang Mai
ร้านอาหารเฮือนกรแก้ว,18.1350136,98.373483,7:30,18:00,Chiang Mai
ครัวนวลพรรณ (ร้านอาหารญี่ปุ่นคุณฝน),18.2523874,98.1998987,7:30,19:00,Chiang Mai
ม่านหมอกคาเฟ่,18.1099318,98.3754307,8:00,0:00,Chiang Mai
สองตังค์,18.20097,98.5960434,10:00,17:00,Chiang Mai
ออบหลวงครัวเมืองทอง,18.2226808,98.4820824,6:00,20:00,Chiang Mai
ร้านน้องบิว อาหารเครื่องดื่ม,18.1556824,98.3862022,8:00,18:00,Chiang Mai
ร้านอาหารตามสั่ง+ก๋วยเตี๋ยว,18.1930833,98.6102119,8:00,0:00,Chiang Mai
ร้านเพื่อนแพ กิโล.6,18.2220062,98.5732727,8:00,18:00,Chiang Mai
อุ๊ยฟอง-Grandma Fong,18.249956,98.193151,0:00,24:00:00,Chiang Mai
ร้านลุงแกละบ้านขุน,18.1045673,98.3745797,8:00,17:00,Chiang Mai
ร้านลาบป้าเพ็ญ​,18.1853483,98.6142011,6:00,19:00,Chiang Mai
แพไอซ์ซี่ - พัทยาฮอด,18.2279189,98.5634003,10:00,19:00,Chiang Mai
อิ๊มอิ่มก๋วยจั๊บน้ำข้น,18.1836189,98.612779,7:30,14:30,Chiang Mai
ร้านป้าทัย,18.1986817,98.5976081,9:00,19:00,Chiang Mai
ร้านอาหารตามสั่ง ป้าบุญเรือน,18.136658,98.3727535,7:30,18:00,Chiang Mai
ร้านตะวัน ก๋วยเตี๋ยว อาหารตามสั่ง,18.0601498,98.3609285,8:00,18:00,Chiang Mai
ต้อม เตี๋ยวเรือยกซด + หนานแดงเย็นตาโฟ สาขาฮอด,18.1945003,98.612221,10:00,21:00,Chiang Mai
Izumidai Shabu อิสุมิไดชาบู,18.1863689,98.6129608,11:00,22:00,Chiang Mai
ครัวพิมพ์ศิริ,18.1339589,98.6419669,6:00,21:00,Chiang Mai
ซาลาเปาตลาดสดฮอด,18.1950728,98.6113795,11:00,15:30,Chiang Mai
ร้านอาหารแม่ทองตามสั่ง,18.098773,98.6885561,9:00,20:00,Chiang Mai
ครัวคุณแอ๋ว2023,18.1469423,98.3488019,9:00,23:00,Chiang Mai
ชายสี่บะหมี่เกี๊ยวเจ้าเก่าเมืองฮอด,18.1962383,98.6111797,11:00,23:00,Chiang Mai
CowBoy House แม่โจ้ ลาบเมืองเหนือ,18.1927594,98.6051195,9:00,20:00,Chiang Mai
ร้านกะเพรารสเด็ด,18.1889033,98.6127417,8:00,21:00,Chiang Mai
ครัวคุณติ๋ว,18.1470738,98.3476933,8:00,0:00,Chiang Mai
ร้านอาหารตามสั่ง ร้านป้าเอ้ย,18.1442582,98.3163715,7:30,19:00,Chiang Mai
กับข้าวป้าเล็กbyNookie (Mama Lek's kitchen by Nookie),18.1882987,98.6123082,15:30,20:30,Chiang Mai
ครัวจ่ากร,18.1411381,98.6024532,9:00,21:00,Chiang Mai
แซ่บ ขนาด,18.1906331,98.6119792,9:30,17:00,Chiang Mai
ลาบอุบล,18.2002657,98.613618,9:00,19:30,Chiang Mai
ร้านข้าวขาหมู ทุ่งสน,18.1522535,98.2895853,7:30,19:00,Chiang Mai
OH Zeed หมูจุ่มชาบู,18.1831536,98.6123472,16:00,22:00,Chiang Mai
เป็ดย่างกาหลง,18.1823795,98.612323,7:30,17:00,Chiang Mai
ร้านบะเห้ย โจ๊ก ต้มเลือดหมู,18.1950742,98.6116029,5:00,9:45,Chiang Mai
น้องไทด์หมูกระทะ ทะเลบุฟเฟ่ต์,18.1665975,98.6085229,17:30,22:30,Chiang Mai
แม่โถ ผัดไทยสะวันนา,18.2504729,98.2027561,8:00,17:00,Chiang Mai
เฮง เฮง ข้าวมันไก่ ข้าวขาหมู ก๋วยเตี๋ยวน่องไก่,18.1902317,98.6120631,8:00,14:00,Chiang Mai
ร้านส้มตำพี่นี หรือ ส้มตำต้นตะขบ,18.1659866,98.6088884,7:00,16:30,Chiang Mai
ข้าวซอยแม่มาลี&กาแฟสด,18.1979309,98.6121795,7:00,16:00,Chiang Mai
ร้านข้าวซอยร่มโพธิ์,18.157173,98.2474007,8:30,17:00,Chiang Mai
ร้านอุ้ยคำ ก๋วยเตี๋ยวเมือง ซาวบาท (หน้า รร.ห้วยฝาง),18.0575743,98.5505994,7:00,18:00,Chiang Mai
ขนมจีนป้าอี๊ดหน้าโรงพัก,18.191093,98.612449,8:00,16:00,Chiang Mai
ร้านก๋วยเตี๋ยวคุณเพ็ญ,18.1940846,98.6133651,9:00,17:00,Chiang Mai
ร้านฮิมตางหม่าล่าหมู่จุ่มปลาจุ่ม,18.1194868,98.6017085,16:00,18:00,Chiang Mai
บ่อหลวง ซีฟู้ด,18.147148,98.357672,7:00,19:00,Chiang Mai
ร้านลาบคนเมืองลุงช่วย,18.1578618,98.2472732,8:00,20:00,Chiang Mai
ลาบส้าบ้านขุน,18.1044668,98.3749694,6:00,18:00,Chiang Mai
ร้านป้าพิมหน้าโรงเรียนบ่อหลวง,18.1511875,98.3542173,6:00,19:00,Chiang Mai
ต้อมก๋วยเตี๋ยวเรือยกซด+หนานแดงเย็นตาโฟสาขาฮอด,18.1944997,98.6120025,10:00,21:00,Chiang Mai
ร้านข้าวยำ(แหนมคลุก)ขนมจีนยายน้อย,18.160247,98.607423,8:30,16:34,Chiang Mai
สลัมเปอร์หม่าล่า,18.1061693,98.2211533,16:00,19:00,Chiang Mai
ก๋วยเตี๋ยวไก่มะระกองลอย,18.1510218,98.2465828,8:00,16:30,Chiang Mai
ปาย เตี๋ยว เรือ หน้าโฮงพักฮอด,18.1905777,98.6124206,8:00,18:00,Chiang Mai
มา กิ๋น ปัง,18.1746157,98.6063953,7:00,17:00,Chiang Mai
สุข ฮิมตาง,18.1577435,98.2469515,9:00,20:00,Chiang Mai
ร้านข้าวแกงสามพี่น้อง,18.1927555,98.6038187,6:00,15:00,Chiang Mai
ร้านไก่ย่างวิเชียรบุรี นาฟ่อน,18.0878441,98.3636424,6:00,19:00,Chiang Mai
ก๋วยเตี๋ยวนำชัย สาขาฮอด,18.197628,98.6119432,10:30,22:00,Chiang Mai
ก๋วยเตี๋ยวลูกชิ้นแชมป์เมืองฮอด,18.1993391,98.6130076,16:00,1:00,Chiang Mai
ร้านระเบียงไม้,18.1642112,98.6081008,8:00,19:00,Chiang Mai
ครัวข้าวเส้น,19.3495197,99.1987915,10:00,21:00,Chiang Mai
ครัวก้าวย่าง,19.3600271,99.2005174,10:00,20:00,Chiang Mai
135 Cafe,19.3382233,99.2052639,8:00,18:00,Chiang Mai
"สิริเมืองพร้าว SiriPhrao, Siri Mueang Phrao",19.4182827,99.1964649,9:00,17:00,Chiang Mai
ซันฮา ดอยขุนแจ๋,19.3263184,99.3200816,9:00,21:00,Chiang Mai
ร้านภูภัคคาเฟ่,19.3584961,99.1992959,16:00,22:30,Chiang Mai
ลาบ 11 พร้าว,19.3691713,99.2025774,10:00,22:00,Chiang Mai
พร้าวโภชนา,19.3675987,99.2022209,8:00,18:00,Chiang Mai
ร้านอาหาร คาเฟ่ โฮมสเตย์ ฮามีนาเม็ง,19.1089884,99.1783632,15:00,12:00,Chiang Mai
Pee Kitchen,19.3663057,99.2040359,9:30,20:00,Chiang Mai
สวนอาหารตะวันแลง,19.2530095,99.1843802,8:00,18:00,Chiang Mai
ครัวภูพร้าว,19.3685343,99.2175208,7:00,20:00,Chiang Mai
ร้านกุ้งเต้นปลาจุ่ม,19.3703476,99.205059,9:00,21:00,Chiang Mai
ในสวนหมูกระทะ,19.3036919,99.2041907,12:00,23:00,Chiang Mai
KR Kaffee by SM Group (Café),19.3679871,99.200835,8:00,17:00,Chiang Mai
ร้านอาหารมารวย (Maruey Restaurant),19.3676849,99.2042738,6:00,20:00,Chiang Mai
คำมูลคาเฟ่,19.3069805,99.1898636,9:00,17:00,Chiang Mai
ล้านลาภหนองเหียง,19.3406519,99.1785045,8:00,19:00,Chiang Mai
เนื้อตุ๋นโอชา,19.3711526,99.2014217,10:00,14:00,Chiang Mai
ออ-พร้าว ชาบู,19.3679778,99.2118895,10:00,22:00,Chiang Mai
ป้าวซักกรึ๊บ (One Drink),19.367742,99.1912174,17:00,23:59,Chiang Mai
ร้านหอมกะเพรา,19.3651413,99.2017408,9:30,20:00,Chiang Mai
ส้มตำ ส.เหนือ,19.3372511,99.1938755,7:00,18:00,Chiang Mai
ชูกาแฟ,19.3652191,99.2036444,8:00,17:00,Chiang Mai
หม่าล่าไรเดอร์ สาขาพร้าว เชียงใหม่,19.2426808,99.1857954,17:00,23:30,Chiang Mai
Phrao vegetarian soup and snacks,19.3654438,99.2047681,9:00,17:00,Chiang Mai
ร้านจิ๊นจุ่มและอาหารตามสั่ง,19.3674493,99.2072952,8:00,20:30,Chiang Mai
ร้านอาหารน้องน้อยอาหาร,19.3686875,99.2243906,9:00,20:00,Chiang Mai
ร้านผัดไทต้นตำรับ,19.3649803,99.2017294,7:00,18:00,Chiang Mai
ร้านลาบขมเจ๊เรียนประดู่,19.2434921,99.1851654,7:00,20:00,Chiang Mai
ครัวป้ามล,19.3675748,99.2024793,9:00,14:00,Chiang Mai
อันยา ชาบู,19.3393896,99.1949011,11:30,23:00,Chiang Mai
ก๋วยเตี๋ยวแม่ป๋าน,19.3026907,99.1993634,9:00,18:00,Chiang Mai
เขยเมืองพร้าว,19.3674586,99.2011222,10:00,20:00,Chiang Mai
Promsud Cafe,19.3696264,99.2017358,8:00,18:30,Chiang Mai
ก๋วยเตี๋ยวเรือคุณหมื่น : Khunmune Boat Noodles,19.3145495,99.1871101,8:00,15:00,Chiang Mai
ดังแม่ป๋อย@ดอยแม่ปั๋ง,19.2228226,99.1844823,7:00,16:00,Chiang Mai
ร้านอาหารสี่หัวใจแห่งขุนเขา,19.3345377,99.2353312,9:30,21:00,Chiang Mai
ณภัชชา​ขนมไทย,19.3681844,99.2173432,11:00,19:00,Chiang Mai
ปีเตอร์ เตี๋ยวเรือรสเยี่ยม,19.2418089,99.1854269,7:00,16:00,Chiang Mai
ร้านนินจาชาบูพร้าว,19.3658959,99.2068614,8:00,18:00,Chiang Mai
ร้านก๋วยเตี๋ยวบ้านบึงป้าว,19.3674339,99.2029478,8:00,17:00,Chiang Mai
ร้านอาหารครัวสบาย,19.3652597,99.2043885,9:00,20:00,Chiang Mai
ครัวซ้ะป๊ะ,19.3687902,99.2029756,7:00,17:00,Chiang Mai
ฮิมนาคาเฟ่ @เมืองป้าว,19.3294443,99.2118212,8:00,18:00,Chiang Mai
ร้านแซ่บนัว ยั่ว Yes สาขาพร้าว,19.3362563,99.1917283,11:00,0:00,Chiang Mai
Shong cha สาขาพร้าว เชียงใหม่,19.3651958,99.202408,8:00,20:00,Chiang Mai
แคบหมู พฤก&พิม,19.3341521,99.2206474,0:00,24:00:00,Chiang Mai
ก๋วยเตี๋ยวต้มยำ เมืองพร้าว,19.367382,99.2010116,8:00,18:00,Chiang Mai
Daniel​'s Burgers,19.36838,99.2061678,10:30,18:30,Chiang Mai
ร้านลาบและอาหารตามสั่ง (บ้านหม้อ อำเภอพร้าว),19.3469699,99.1981845,9:00,17:00,Chiang Mai
ต้องตำ ลำปลาแดก,19.3156908,99.1900763,10:00,20:00,Chiang Mai
ชาหอมบ้านคุณยาย,19.3676155,99.2019824,7:30,16:30,Chiang Mai
ร้านลาบป้าแดง,19.3633383,99.2067136,7:00,17:30,Chiang Mai
ครัวบ้านหม่อน,19.39154,99.2019264,9:00,18:00,Chiang Mai
ร้านฉลวย ก๋วยเตื๋ยวเนื้อตุ๋น,19.3652883,99.2067715,7:30,14:30,Chiang Mai
สวนอาหารลานคูน วิวดอยเฮาส์,19.3488045,99.1989868,8:00,18:00,Chiang Mai
แหม่ม หมูย่าง ปลาเผา ไส้อั่ว,19.3691687,99.2020539,15:00,21:00,Chiang Mai
ร้านตี๋โภชนา+ร้านเหล้าปั่นคาราโอเก,19.3649069,99.1970387,10:00,20:30,Chiang Mai
ส้มตำยำแซ่บพร้าวพารากอน,19.3682395,99.2043647,10:00,20:00,Chiang Mai
ร้านเย็นตาโฟต้มยำ สี่แยก ธกส พร้าว,19.3674161,99.2039372,9:00,18:00,Chiang Mai
ร้านข้าวมันไก่เบตง,19.3550215,99.1981793,7:00,15:00,Chiang Mai
ร้านทองดีโภชนา,19.3677046,99.2026719,16:00,1:00,Chiang Mai
แม่แดง I ขนมจีน ก๋วยเตี๋ยว ข้าวซอย,19.3432608,99.1964441,8:00,18:00,Chiang Mai
ปี้คุมส้มตำ,19.3686165,99.2074026,9:00,17:00,Chiang Mai
เตี๋ยวควายหนานแดง,19.2236857,99.1851225,8:00,17:00,Chiang Mai
ร้าน เย็นตาโฟต้มยำหน้าวัดป่าแขม,19.3041522,99.1985266,9:00,17:00,Chiang Mai
ก๋วยเตี๋ยวป้าพรรณหน้า อบต.แม่แวน,19.3109541,99.1898002,6:00,20:00,Chiang Mai
ศุภภาพร,19.3393402,99.2155532,8:00,18:00,Chiang Mai
ร้านก๋วยเตี๋ยว แม่ทอง บ้านดอยใต้,19.3637868,99.2142635,8:00,15:00,Chiang Mai
ร้านก๋วยเตี๋ยวต้มยำลูกชิ้นจัมโบ้,19.3150453,99.1904966,7:00,19:00,Chiang Mai
บุฟเฟ่ต์หมูกระทะบ้านอารีย์,19.3448618,99.1972488,16:00,23:00,Chiang Mai
ยุ้ง-ขะ-หนม Yung Kha Nome,19.3735765,99.2304689,8:00,20:00,Chiang Mai
บ้านหนมเส้น เฉ๋าก๊วยนมสด,19.3649277,99.2070323,7:00,18:00,Chiang Mai
แม่ปั๋ง แคมป์ปิ้ง,19.2170105,99.1573031,10:00,18:00,Chiang Mai
ร้านก๋วยเตี๋ยวหมู-เนื้อ สูตรต้นตำรับ อ.พร้าว พี่อึ่ง พี่ส่วน,19.3688545,99.2250496,10:00,20:00,Chiang Mai
ร้านอิ๋มมันส์ไก่&ก๋วยเตี๋ยวโกเด้งหน้าโฮงยา,19.367525,99.2008929,11:00,21:00,Chiang Mai
แลงมาจอย ณ.พร้าว,19.3591937,99.1782079,17:00,21:00,Chiang Mai
ร้านขนมจีนน้ำเงี้ยวแม่น้องพร,19.366082,99.20446,3:30,13:00,Chiang Mai
ร้านก๋วยเตี๋ยวเป็ดตุ๋น,19.3062419,99.1898803,8:30,16:30,Chiang Mai
ร้านน้องปริ๊นซ์ข้าวมันไก่,19.3398283,99.1989219,8:00,15:00,Chiang Mai
Check In Doi Tao Cafe’ & Resort,17.9958045,98.6928265,8:00,17:00,Chiang Mai
ร้านอาหารลูกแม่ปิง สาขา2,17.922093,98.7233555,6:00,22:00,Chiang Mai
ครัวมะขามหวาน,17.9374498,98.7149573,8:00,21:30,Chiang Mai
ร้านเนเจอร์คาเฟ่,17.9388146,98.7203189,8:00,15:00,Chiang Mai
ครัวบ้านกุ้ง,18.0272759,98.6611614,10:00,19:00,Chiang Mai
SURANUN Café,17.9495872,98.6901229,7:00,23:00,Chiang Mai
ร้านอาหารครัวย่าตุ๋ย,17.8913314,98.7423314,7:30,17:30,Chiang Mai
ร้านสายใจ อาหารตามสั่ง ก๋วยเตี๋ยว ของชำ/เครื่องดื่ม,18.0616798,98.6367492,8:00,21:00,Chiang Mai
ร้านกับข้าวกับโก้ ข้าวขาหมู หมูกรอบ หมูแดง อาหารตามสั่ง,17.9158701,98.7267361,8:30,19:00,Chiang Mai
ร้าน แตมป์ตังค์ อาหารเซียน,18.0276063,98.6615003,9:00,17:00,Chiang Mai
เฮือนฮักดา,17.9265943,98.7055614,8:00,16:00,Chiang Mai
ร้านอาหารตามสั่งแม่แดงMaeang street food,17.9148399,98.7269028,8:00,19:30,Chiang Mai
ฮ่อมหน้อย คาเฟ่ Hom Noi Cafe,17.949394,98.690311,8:00,17:00,Chiang Mai
ร้านอาหารตามสั่งและก๋วยเตี๋ยว บ้านแม่ทิศ,18.0185773,98.6704064,8:00,14:00,Chiang Mai
ร้านอาหารตามสั่ง ฟ้าใส,17.9539593,98.6823735,8:00,18:00,Chiang Mai
ร้านอาหารทะเลแห้งดอยเต่า,17.8913297,98.7423309,0:00,24:00:00,Chiang Mai
ร้านอาหาร บ้านไร่เก็บตะวันรีสอร์ท,17.8958238,98.7946932,8:30,17:00,Chiang Mai
ร้านแม่แฮ๊กอาหารตามสั่ง,17.8913488,98.7421145,7:30,17:30,Chiang Mai
ร้านเครปบ้านแอ่น,18.0375876,98.6282529,10:00,20:00,Chiang Mai
ร้านลาบอส. เเปลง2,17.9286646,98.726098,8:00,17:00,Chiang Mai
อุษาโภชนา,19.7189711,99.1411646,9:00,19:30,Chiang Mai
ร้านอาหารจีนมาเฮง,19.7394771,99.1427852,10:00,22:00,Chiang Mai
ป๊อป - เป้ Coffee & Bakery,19.7423273,99.1435253,7:00,19:00,Chiang Mai
อาหาร ริมทาง,19.7027222,99.1457315,7:00,18:00,Chiang Mai
ยำปูม้าเจ็ดยอดสาขากุสุมาคาเฟ่ไชยปราการ,19.652979,99.1469664,7:30,20:00,Chiang Mai
ครัวผาหงษ์,19.6443431,99.1361533,9:30,22:00,Chiang Mai
ตำปูม้าไชยปราการ,19.7472645,99.1444154,9:00,20:00,Chiang Mai
ครัวข้าวหอม,19.7021943,99.146143,8:00,19:00,Chiang Mai
ร้านลาบไชยปราการ,19.7346046,99.1416093,8:30,18:00,Chiang Mai
บ้านสวนไชยปราการ,19.7217357,99.1405016,9:00,0:00,Chiang Mai
โชว์กึ๋น Steak house,19.7258644,99.1398449,11:00,21:00,Chiang Mai
ผาซ่อนดาว​ คาเฟ่ Phasondao Café,19.6211292,99.1277465,7:30,16:30,Chiang Mai
เจ๊นงเจ้าเก่า,19.7159214,99.1419219,9:00,19:30,Chiang Mai
Room 88,19.7226152,99.1406498,16:00,0:00,Chiang Mai
กุสุมาคาเฟ่ & Restaurant,19.6529847,99.1469919,7:30,20:00,Chiang Mai
ร้านขนมจีนป้าเกต ไชยปราการ,19.7118946,99.1425602,7:00,18:00,Chiang Mai
ซุ้มริมน้ำไชยปราการ,19.664206,99.143428,0:00,24:00:00,Chiang Mai
ร้านอาหารโกชาย,19.726224,99.1401878,6:00,15:00,Chiang Mai
ร้านเล็กสเปคJR,19.7000924,99.1467287,9:00,22:00,Chiang Mai
รสเนื้อ สาขาไชยปราการ,19.7288247,99.1406538,8:00,15:00,Chiang Mai
ร้านครัวสุมาลี,19.6838111,99.149309,8:00,18:00,Chiang Mai
ครัวบ้านอ่าย,19.6730466,99.1465315,6:30,19:00,Chiang Mai
ร้านลาบบ้านอ่าย,19.6870209,99.1494204,9:00,18:00,Chiang Mai
ตราชั่ง ไชยปราการ,19.7074512,99.1439321,7:00,18:00,Chiang Mai
NARA COFFEE THAILAND,19.6483811,99.1444428,8:00,17:00,Chiang Mai
ร้านซิงหยี เกี๊ยวซ่า,19.7246176,99.0998256,11:00,18:00,Chiang Mai
ร้านอาหารไทย-จีน สไตล์ยูนนาน,19.7222354,99.0965972,8:00,16:00,Chiang Mai
ครัวเชฟตั้ม,19.7413815,99.1434243,9:00,22:00,Chiang Mai
ไชยปราการ อาหารไทย,19.736107,99.142129,8:00,17:00,Chiang Mai
เตี๋ยวควาย “ป้อสล่า”,19.7080439,99.1437716,7:00,15:30,Chiang Mai
